"tweet_id","in_reply_to_status_id","in_reply_to_user_id","retweeted_status_id","retweeted_status_user_id","timestamp","source","text","expanded_urls"
"32247303838367744","","90286855","","","2011-02-01 01:22:11 +0000","<a href=""http://twitter.com/download/iphone"" rel=""nofollow"">Twitter for iPhone</a>","@changelogshow @jonsterling having a great time with githubby for iOS repo browsing in case you guys missed it"
"32137873809477632","","","","","2011-01-31 18:07:20 +0000","<a href=""http://twitter.com/download/iphone"" rel=""nofollow"">Twitter for iPhone</a>","?@louisgray: The Silicon Valley Bubble is Not one of Valuation, but Optimism http://goo.gl/fb/D2wBZ?"
"32137648491462656","32116939228717056","14248746","","","2011-01-31 18:06:27 +0000","<a href=""http://twitter.com/download/iphone"" rel=""nofollow"">Twitter for iPhone</a>","@Ccrystle good hunting, there's likely a few hot shot rails hackers in your area, have you checked community hubs (railscasts, LinkedIn)"
"32101636465758208","","","","","2011-01-31 15:43:21 +0000","<a href=""http://twitter.com/download/iphone"" rel=""nofollow"">Twitter for iPhone</a>","?@asmartbear: Color Wheels are wrong? How color vision actually works: http://bit.ly/ClrWheel? /complements human vision http://j.mp/hppLvH"
"32097862120644608","32097320707293184","13127812","","","2011-01-31 15:28:21 +0000","<a href=""http://twitter.com/download/iphone"" rel=""nofollow"">Twitter for iPhone</a>","@reecepacheco sunday nights are rough for me, but local NYC'ers can benefit from a quick chat"
"32097379532410880","","","","","2011-01-31 15:26:26 +0000","<a href=""http://twitter.com/download/iphone"" rel=""nofollow"">Twitter for iPhone</a>","githubby is a very nice free alternative for an iOS git app"
"32095529114542080","","","","","2011-01-31 15:19:05 +0000","<a href=""http://twitter.com/download/iphone"" rel=""nofollow"">Twitter for iPhone</a>","?@changelogshow: Githood: A minimal #GitHub client for iOS from @jonsterling http://lg.gd/7c?"
"32095478325714944","32080428009521152","15031464","","","2011-01-31 15:18:52 +0000","<a href=""http://twitter.com/download/iphone"" rel=""nofollow"">Twitter for iPhone</a>","@dgentry @jowyang Friendfeed was my first exp with social platforms who's devs are ""bought out"". Made me apprec ostatus/open source more"
"32093661982359552","","","","","2011-01-31 15:11:39 +0000","<a href=""http://twitter.com/download/iphone"" rel=""nofollow"">Twitter for iPhone</a>","?@sgblank: Startups - So Easy a 12 Year Old Can Do It: http://wp.me/prGQZ-20Y?"
"32092465280319488","","","","","2011-01-31 15:06:54 +0000","<a href=""http://twitter.com/download/iphone"" rel=""nofollow"">Twitter for iPhone</a>","?@reecepacheco: want to meet me? announcing my office hours (@Ohours). cc: @vacanti, @bryce, @whitneyhess http://tumblr.com/x0g1e475wc?"
"32071762359353344","","","","","2011-01-31 13:44:38 +0000","<a href=""http://twitter.com/download/iphone"" rel=""nofollow"">Twitter for iPhone</a>","?@marcoarment: My speculation on the next MacBook Pro: http://t.co/chncIZM? /well thought guesses","http://www.marco.org/3027446896"
"32070496258359296","","","31956864384110592","188768528","2011-01-31 13:39:36 +0000","<a href=""http://twitter.com/download/iphone"" rel=""nofollow"">Twitter for iPhone</a>","RT @FAKEGRIMLOCK: RE: @infoarbitrage MAYBE THIS FINALLY CONVINCE STARTUPS NOT IN ONE OF 5 MAJOR HUBS GIVE UP, STOP INNOVATING. WHAT POI? ..."
"32069768626311169","","","","","2011-01-31 13:36:43 +0000","<a href=""http://twitter.com/download/iphone"" rel=""nofollow"">Twitter for iPhone</a>","?@ceonyc: New post: $30,191 http://bit.ly/es8XXI?"
"32059805132656640","32046461889814528","19643315","","","2011-01-31 12:57:07 +0000","web","@vsagarv good response to fred and chris :D, happy monday"
"32059683678191616","","","32046461889814528","19643315","2011-01-31 12:56:38 +0000","web","RT @vsagarv: @fredwilson To make @cdixon's ""Get rejected daily"" post work, someone has to be the ""no sayer"" :) http://bit.ly/h1TLOp"
"32055805821853696","","","","","2011-01-31 12:41:14 +0000","<a href=""http://twitter.com/tweetbutton"" rel=""nofollow"">Tweet Button</a>","Introspection 18 months later, are you an entrepreneur? http://t.co/kcI8d4r /follow up to @msusters TechCrunch post","http://www.victusspiritus.com/2011/01/31/introspection-18-months-later-are-you-an-entrepreneur/"
"32042582573842432","","","","","2011-01-31 11:48:41 +0000","<a href=""http://instagr.am"" rel=""nofollow"">Instagram</a>","the snow trail with a touch of the darkside  @ Stony Brook University http://instagr.am/p/BT8A7/"
"32041938450391040","","","","","2011-01-31 11:46:08 +0000","<a href=""http://instagr.am"" rel=""nofollow"">Instagram</a>","winter walk, we're really not from DC those are the only hats we could find  @ Stony Brook University http://instagr.am/p/BT74i/"
"31909674798284800","","","","","2011-01-31 03:00:33 +0000","<a href=""http://twitter.com/download/iphone"" rel=""nofollow"">Twitter for iPhone</a>","?@johndbritton: Help out the @githacking team. Find Hackers, Get Promote Projects, Get Rewarded. #phlsw http://redd.it/fbyao?"
"31908505040453632","31785913029758976","28520903","","","2011-01-31 02:55:55 +0000","<a href=""http://twitter.com/download/iphone"" rel=""nofollow"">Twitter for iPhone</a>","@ScepticGeek if I had a personal relevance quality score to all folks I follow on twitter, you'd be in the top 5 on a bad day"
"31906372828266497","","","","","2011-01-31 02:47:26 +0000","<a href=""http://twitter.com/download/iphone"" rel=""nofollow"">Twitter for iPhone</a>","?@mattwensing: The value of your product = the surplus of success it creates for its users (don't forget, they get to define success).?"
"31905367810121728","31546317268328448","15031464","","","2011-01-31 02:43:27 +0000","<a href=""http://twitter.com/download/iphone"" rel=""nofollow"">Twitter for iPhone</a>","@dgentry I think so, if Huffman encoding why not wavelet compression."
"31766073321721856","","","","","2011-01-30 17:29:56 +0000","<a href=""http://twitter.com"" rel=""nofollow"">Tweetie for Mac</a>","3 Projects to Create a Government-less Internet, and Why It?s Needed - Dateline Zero http://j.mp/gOy8FS (via @ScepticGeek) /good stuff"
"31764570250944514","","","","","2011-01-30 17:23:58 +0000","<a href=""http://twitter.com/tweetbutton"" rel=""nofollow"">Tweet Button</a>","How about a question and answer plugin for blogs? http://t.co/SGDD1PP in response to @scobleizer http://t.co/B93FWrV","http://www.victusspiritus.com/2011/01/30/how-about-a-question-and-answer-plugin-for-blogs/","http://scoble.it/fvtewx"
"31735969128386560","","","","","2011-01-30 15:30:19 +0000","<a href=""http://instagr.am"" rel=""nofollow"">Instagram</a>","dog run carved out of snow  @ home http://instagr.am/p/BS6zV/"
"31683410619539457","","","","","2011-01-30 12:01:28 +0000","<a href=""http://twitter.com/download/iphone"" rel=""nofollow"">Twitter for iPhone</a>","?@manielse: Scientists locate the biological clock of all living things http://bit.ly/faghKy? /from red blood cells to algae"
"31681279757914112","31052953569722368","14498374","","","2011-01-30 11:53:00 +0000","<a href=""http://twitter.com/download/iphone"" rel=""nofollow"">Twitter for iPhone</a>","@fritzy talking with enthusiastic fellow coders about your problem specifics is helpful too, walking them through it concentrates thought"
"31674927086047232","31033652808781824","12735452","","","2011-01-30 11:27:45 +0000","<a href=""http://twitter.com/download/iphone"" rel=""nofollow"">Twitter for iPhone</a>","@falicon machine learning about financial systems, @nikete and @dpinsen mastering market tools :)"
"31673617548840960","31031239427235840","18079631","","","2011-01-30 11:22:33 +0000","<a href=""http://twitter.com/download/iphone"" rel=""nofollow"">Twitter for iPhone</a>","@mattmireles General Assembly's got a business model, they charge for access $300-500/month. nice coworking space + classes!"
"31673088139595776","","","","","2011-01-30 11:20:27 +0000","<a href=""http://twitter.com/download/iphone"" rel=""nofollow"">Twitter for iPhone</a>","?@alsutton: @Paul_Kinlan You'd need to mix ~50% whole milk & ~50% whipping cream to get something similar? /good with a scone?"
"31672326017785856","","","","","2011-01-30 11:17:25 +0000","<a href=""http://twitter.com/download/iphone"" rel=""nofollow"">Twitter for iPhone</a>","Prof. J?rgen Schmidhuber's wants to build the optimal scientist then retire http://j.mp/g1mgi3 /toughest challenge will be imagination"
"31481773963616256","31447964920582144","12241752","","","2011-01-29 22:40:14 +0000","<a href=""http://twitter.com"" rel=""nofollow"">Tweetie for Mac</a>","@maxogden in theory I could drive up if you guys have any weekend hack events, i'm a ferry and 3hour drive away (across connecticut/mass)"
"31476205765005312","","","","","2011-01-29 22:18:06 +0000","<a href=""http://twitter.com"" rel=""nofollow"">Tweetie for Mac</a>","Yay! A new cousin, by @bradfitz and friends. http://camlistore.org/ (via @patcito) (via @CouchDB)"
"31475870623342592","31473197853446144","90048571","","","2011-01-29 22:16:47 +0000","<a href=""http://twitter.com"" rel=""nofollow"">Tweetie for Mac</a>","@ScotterC @artsiclle gotta's be in that next class! go go go"
"31474029361631233","","15102110","","","2011-01-29 22:09:28 +0000","<a href=""http://twitter.com"" rel=""nofollow"">Tweetie for Mac</a>","@HenrikJoreteg you're obscurely famous, mentioned you in a blog post about underscore.js (thanks for sharing that find) http://bit.ly/dZbPrU"
"31473622841303040","","12735452","","","2011-01-29 22:07:51 +0000","<a href=""http://twitter.com"" rel=""nofollow"">Tweetie for Mac</a>","@falicon wanted to make sure you saw this http://tcrn.ch/hN8kh5 typo'd Marshall Kirkpatrick's twitter id instead of yours, long day coding"
"31473309291909120","","818340","","","2011-01-29 22:06:36 +0000","<a href=""http://twitter.com"" rel=""nofollow"">Tweetie for Mac</a>","@marshallk brain typo on that last mention, was trying to forward that TC blanket angel funding in YC startups to Kevin Marshall"
"31473120258818048","31471992989294592","90048571","","","2011-01-29 22:05:51 +0000","<a href=""http://twitter.com"" rel=""nofollow"">Tweetie for Mac</a>","@ScotterC "" And Milner/SV Angel say they intend to offer this for each Y Combinator startup in the future, too."" cc @falicon"
"31471882473570304","","","","","2011-01-29 22:00:56 +0000","<a href=""http://twitter.com/tweetbutton"" rel=""nofollow"">Tweet Button</a>","Start Fund: Yuri Milner, SV Angel Offer EVERY New Y Combinator Startup?$150k http://t.co/ie1Sb2M via @techcrunch cc @marshallk @scotterc","http://tcrn.ch/gJ6Twa"
"31471451202650114","","","","","2011-01-29 21:59:13 +0000","<a href=""http://twitter.com/tweetbutton"" rel=""nofollow"">Tweet Button</a>","The joy of function chaining and callbacks with jQuery and underscore.js http://t.co/iRcHOZD /chock full of Saturday scripting goodness","http://www.victusspiritus.com/2011/01/29/the-joy-of-function-chaining-and-callbacks-with-jquery-and-underscore-js/"
"31405699191803904","","","","","2011-01-29 17:37:56 +0000","<a href=""http://instagr.am"" rel=""nofollow"">Instagram</a>","I dub thee ""sex delicious pizza"", taco/pizza hybrid of endorphin releasing madness  @ home http://instagr.am/p/BRmI-/"
"31083082601734145","","","","","2011-01-28 20:15:59 +0000","<a href=""http://twitter.com/tweetbutton"" rel=""nofollow"">Tweet Button</a>","Dynamic scripting with static speed, the best of both worlds http://t.co/g1Z98sB /not a new idea, but a new application has opened to me","http://www.victusspiritus.com/2011/01/28/dynamic-scripting-with-static-speed-the-best-of-both-worlds/"
"31071949325074432","","","","","2011-01-28 19:31:44 +0000","<a href=""http://twitter.com"" rel=""nofollow"">Tweetie for Mac</a>","""Holy crap, look at these protesters push police forces back across a bridge in Cairo http://bit.ly/fHfR1b #Egypt "" (via @orian) /unrest"
"30971371324440576","30970939873165312","101025176","","","2011-01-28 12:52:05 +0000","<a href=""http://twitter.com/download/iphone"" rel=""nofollow"">Twitter for iPhone</a>","@Paul_Kinlan thanks, realized that after."
"30931711558688768","","","","","2011-01-28 10:14:29 +0000","<a href=""http://twitter.com/download/iphone"" rel=""nofollow"">Twitter for iPhone</a>","?@giffconstable: Andreessen 3 lists / 3 must-do things http://bit.ly/fi61ov? /had to chuckle at #productivitypr0n"
"30822750771744768","30822488631939072","15031464","","","2011-01-28 03:01:31 +0000","<a href=""http://twitter.com/download/iphone"" rel=""nofollow"">Twitter for iPhone</a>","@dgentry so bizarre, how this posting pick up thing works. my december was very flat for views, today was good."
"30820400896151554","","","","","2011-01-28 02:52:10 +0000","<a href=""http://twitter.com/download/iphone"" rel=""nofollow"">Twitter for iPhone</a>","?@dcancel: Landmines on the Road to Product Market Fit -  http://bit.ly/gi5HdZ #leanstartups?"
"30818368827170816","30607653570871296","28520903","","","2011-01-28 02:44:06 +0000","<a href=""http://twitter.com/download/iphone"" rel=""nofollow"">Twitter for iPhone</a>","@ScepticGeek now that those changes effects are summed up, I think we need some more quality filters :)"
"30817131150966785","30605659749744640","5813712","","","2011-01-28 02:39:11 +0000","<a href=""http://twitter.com/download/iphone"" rel=""nofollow"">Twitter for iPhone</a>","@antirez will there be an ebook form (app, kindle, PDF)? I have piles of books that I never have with me when I find the moment to read :)"
"30816634465681409","30601164881924097","15031464","","","2011-01-28 02:37:12 +0000","<a href=""http://twitter.com/download/iphone"" rel=""nofollow"">Twitter for iPhone</a>","@dgentry hah, makes it fun. was it pure luck, or was there more to it? which post, the initialization one?"
"30815603484794880","30599539102580736","19643315","","","2011-01-28 02:33:07 +0000","<a href=""http://twitter.com/download/iphone"" rel=""nofollow"">Twitter for iPhone</a>","@vsagarv bookmarked after skimming, enjoying the design methodology in that post"
"30786643430481920","","","","","2011-01-28 00:38:02 +0000","<a href=""http://twitter.com"" rel=""nofollow"">Tweetie for Mac</a>","Last night,Googling boing boing api got you no relevant hits. Not any more :-) http://bit.ly/hog06i (via @terrycojones) http://bit.ly/frUhTm"
"30781867745615872","","","","","2011-01-28 00:19:03 +0000","<a href=""http://www.tweetdeck.com"" rel=""nofollow"">TweetDeck</a>","Dosbox http://j.mp/x95v1 + Champions of Krynn http://j.mp/htdW3F = nostalgic pleasure"
"30779274625556480","","","","","2011-01-28 00:08:45 +0000","<a href=""http://www.google.com/"" rel=""nofollow"">Google</a>","I liked a YouTube video -- Champions of Krynn http://youtu.be/UEpzGOvw1bQ?a"
"30776183008268289","","","","","2011-01-27 23:56:28 +0000","<a href=""http://twitter.com"" rel=""nofollow"">Tweetie for Mac</a>","Woohoo, created my first chromium web store app http://bit.ly/fVmmWW thanks to @Paul_Kinlan http://appmator.appspot.com/ couple of redos"
"30759423592894464","","","","","2011-01-27 22:49:52 +0000","<a href=""http://twitter.com/tweetbutton"" rel=""nofollow"">Tweet Button</a>","Cloud9 IDE - The Javascript IDE, by Javascripters for Javascripters http://t.co/SaQfTuc so far it's pretty smooth","http://www.cloud9ide.com/"
"30722575449464832","","","","","2011-01-27 20:23:27 +0000","<a href=""http://twitter.com"" rel=""nofollow"">Tweetie for Mac</a>","Demand Media should buy New York Times $nyt and turn it into a classified section for bloggers $dmd (via @howardlindzon) #sinister"
"30722130043740160","","","30718509013012480","87133189","2011-01-27 20:21:41 +0000","web","RT @dpinsen: Seeking Alpha interview w/ me re: Short Screen; $AAPL iPad giveaway; $JDSU $VRSN $JOBS $HUSA $OII $DV $STRA  #37Signals htt ..."
"30717481811189760","","","","","2011-01-27 20:03:13 +0000","<a href=""http://twitter.com"" rel=""nofollow"">Tweetie for Mac</a>","I could read these tabs or get some coding done  http://yfrog.com/h3a7jp , gonna tabsense crunch them & get to work"
"30716179790172161","30655591785435136","5813712","","","2011-01-27 19:58:02 +0000","<a href=""http://twitter.com"" rel=""nofollow"">Tweetie for Mac</a>","@antirez was thinking about that myself, maybe so branch can default to master if left off? could work either way though"
"30715810687229953","30653688309616640","14098423","","","2011-01-27 19:56:34 +0000","<a href=""http://twitter.com"" rel=""nofollow"">Tweetie for Mac</a>","@ccrystle @johndbritton just mentioned startup weekend philly, how far is that from Lancaster? http://bit.ly/ezje23 #recruit_rails_hackers"
"30714796550656000","30651860062830592","14366258","","","2011-01-27 19:52:32 +0000","<a href=""http://twitter.com"" rel=""nofollow"">Tweetie for Mac</a>","@ecaron he's gotta start small. if he can get a few tightly packed folks to try the game, and they absolutely love it, it'll grow."
"30714479125725184","30650202457120768","3364401","","","2011-01-27 19:51:17 +0000","<a href=""http://twitter.com"" rel=""nofollow"">Tweetie for Mac</a>","@nickhalstead I get by without mac office at home, but rely heavily on converting to goog docs/open office as needed"
"30714074060816386","","14248746","","","2011-01-27 19:49:40 +0000","<a href=""http://twitter.com"" rel=""nofollow"">Tweetie for Mac</a>","@ccrystle @manielse thanks for sharing the post gents, glad you enjoyed it. gotta grow that failure list fast until it derails w/ success :)"
"30711414716899328","","","","","2011-01-27 19:39:06 +0000","<a href=""http://twitter.com"" rel=""nofollow"">Tweetie for Mac</a>","Rails Developers in Central PA: http://t.co/YJEwd6I (via @Ccrystle) /Charlie's zeroing in on relevance, go help him filter the world","http://wp.me/pwL5b-4j"
"30710438073208832","","","","","2011-01-27 19:35:13 +0000","<a href=""http://twitter.com"" rel=""nofollow"">Tweetie for Mac</a>","Don Johnson approves of AngelList you should to http://angel.co/reviews via @venturehacks"
"30710192110829568","30675884528631809","28520903","","","2011-01-27 19:34:15 +0000","<a href=""http://twitter.com"" rel=""nofollow"">Tweetie for Mac</a>","@ScepticGeek @dgentry best comparison I heard was Scoble's interview of Clay Shirky at Davos http://bit.ly/fuwfmH"
"30709986556383232","30689040663576576","652193","","","2011-01-27 19:33:26 +0000","web","@parislemon chromium & flash play nice on my mac, maybe a chrome thing? here's what I use: http://bit.ly/feXMew"
"30706935569321984","30696463075901441","18713","","","2011-01-27 19:21:18 +0000","web","@al3x your lips move, but I can't hear what you're saying..."
"30705424143491073","","","","","2011-01-27 19:15:18 +0000","web","""John has created adapters for Riak, memcached, Redis, & Cassandra"" toystore: Ruby ORM for key-value stores http://bit.ly/h3zOC0 +couchdb?"
"30704321117032448","","","","","2011-01-27 19:10:55 +0000","<a href=""http://twitter.com"" rel=""nofollow"">Tweetie for Mac</a>","It was fun reading @antirez's background http://bit.ly/hML1ct been reading about redis for months, never knew Salvatore worked for vmware :D"
"30701034942763008","","","","","2011-01-27 18:57:51 +0000","web","You don't need a good idea to start a great company: http://t.co/bzJq6pn by @eladgil","http://news.ycombinator.com/item?id=2148595"
"30678389522169856","","","","","2011-01-27 17:27:52 +0000","<a href=""http://twitter.com/download/iphone"" rel=""nofollow"">Twitter for iPhone</a>","?@ScepticGeek: Zuckerberg's Facebook fan page hack came from a US Dept of Defense IP Address http://j.mp/gWrWQh? fun trail cc @aakin"
"30677040562708480","","","","","2011-01-27 17:22:31 +0000","<a href=""http://twitter.com/download/iphone"" rel=""nofollow"">Twitter for iPhone</a>","?@andraz: DontEat.at http://bit.ly/hjAXQD [Finally a reason to check-in]?"
"30676880579366913","30674279590793216","14098423","","","2011-01-27 17:21:52 +0000","<a href=""http://twitter.com/download/iphone"" rel=""nofollow"">Twitter for iPhone</a>","@johndbritton ha, your too fast. awesome page, shooting it to my job search gmail tag which I never look at. Cofounding has a better ring :)"
"30676425434472448","30434719921344512","79543","","","2011-01-27 17:20:04 +0000","<a href=""http://twitter.com/download/iphone"" rel=""nofollow"">Twitter for iPhone</a>","@jowyang namesake has LinkedIn features as well, recommendations.."
"30675652373909504","","","","","2011-01-27 17:17:00 +0000","<a href=""http://twitter.com/download/iphone"" rel=""nofollow"">Twitter for iPhone</a>","?@sengineland: Upstart DuckDuckGo Challenges Google With Strong Privacy, Cool Tools & Quackpot Name http://selnd.com/eQGBbY? via @yegg"
"30675564842979329","","","","","2011-01-27 17:16:39 +0000","<a href=""http://twitter.com/download/iphone"" rel=""nofollow"">Twitter for iPhone</a>","?@evanpro: Hey, I'm the new community board member on the Open Social Foundation.? gratz, right guy for the team."
"30674569148764160","30399014423764992","42983","","","2011-01-27 17:12:41 +0000","<a href=""http://twitter.com/download/iphone"" rel=""nofollow"">Twitter for iPhone</a>","@terrycojones great to hear :), it's been quiet too long for my FluidDB news"
"30674144605507584","30394103447425024","14098423","","","2011-01-27 17:11:00 +0000","<a href=""http://twitter.com/download/iphone"" rel=""nofollow"">Twitter for iPhone</a>","@johndbritton you're a nexus, no surprise you see more demand than tech supply. Time for a John Britton job board ;)"
"30673011958874112","","","30392067314159616","4641021","2011-01-27 17:06:30 +0000","<a href=""http://twitter.com/download/iphone"" rel=""nofollow"">Twitter for iPhone</a>","RT @RWW: iPhone App Lets Soldiers Map Their Battlefields http://rww.to/ffQDXM"
"30672457878732801","30384815261876224","17365085","","","2011-01-27 17:04:18 +0000","<a href=""http://twitter.com/download/iphone"" rel=""nofollow"">Twitter for iPhone</a>","@ihumanable :(, you still in charge of making everything compatible with web 0.0. Do visitor stats show the need for it?"
"30671978411073536","26564946829512704","14343113","","","2011-01-27 17:02:24 +0000","<a href=""http://twitter.com/download/iphone"" rel=""nofollow"">Twitter for iPhone</a>","@jon_y epic quest, thx for coordinating the madness. my wife kept looking at me strange, ""don't you have 50+ gigs?"", my answer, ""adventure!"""
"30671221657968640","30375107406860289","14098423","","","2011-01-27 16:59:23 +0000","<a href=""http://twitter.com/download/iphone"" rel=""nofollow"">Twitter for iPhone</a>","@johndbritton :), sinister captcha but you get to learn wild escape characters :()"
"30670576410431490","","","","","2011-01-27 16:56:49 +0000","<a href=""http://twitter.com/download/iphone"" rel=""nofollow"">Twitter for iPhone</a>","?@azaaza: RT @fastcodesign: Crazy UI Idea from @azaaza: Our Phones Should Speak In Vibrated Text. It might work http://bit.ly/guwm80? groovy"
"30670013044105216","","","30355233607520256","817288","2011-01-27 16:54:35 +0000","<a href=""http://twitter.com/download/iphone"" rel=""nofollow"">Twitter for iPhone</a>","RT @gaberivera: It sucks for @blekko and @duckduckgo that http://www.quora.com/robots.txt blocks all but the biggest search engines."
"30669874825011200","","","30353054951800832","14135545","2011-01-27 16:54:02 +0000","<a href=""http://twitter.com/download/iphone"" rel=""nofollow"">Twitter for iPhone</a>","RT @akumar: Randy Pausch: ?Brick walls are there to show you how bad you want something.?"
"30668636913934337","30661703532281856","5381582","","","2011-01-27 16:49:07 +0000","web","@julien51 damnable weather. third wall i had to dig out this year. Today's was nearly four feet of ice/snow (I get plowed in badly)"
"30668436422008832","30661824089165824","3364401","","","2011-01-27 16:48:19 +0000","web","@nickhalstead @dedipower $?"
"30668306381807616","30667704687923200","2529971","","","2011-01-27 16:47:48 +0000","web","@cdixon @infoarbitrage Roger's answer inspired a post out of me this morning. great stuff."
"30668040274186240","","","","","2011-01-27 16:46:45 +0000","web","Balanced interview of @umairh and thin value problem on venturebeat  http://ow.ly/1b3uRk"
"30629661704716288","","","","","2011-01-27 14:14:15 +0000","<a href=""http://twitter.com/tweetbutton"" rel=""nofollow"">Tweet Button</a>","What do people usually do after they run a failed startup? http://t.co/fAA8wzf cc @infoarbitrage @fredwilson","http://www.victusspiritus.com/2011/01/27/what-do-people-usually-do-after-they-run-a-failed-startup/"
"30614125277085696","","","","","2011-01-27 13:12:30 +0000","<a href=""http://twitter.com/download/iphone"" rel=""nofollow"">Twitter for iPhone</a>","?@timoreilly: Ouch. Word clouds of what Obama said vs. what America heard: http://bit.ly/dH98PM #sotu? #salmon"
"30422950582689792","","","","","2011-01-27 00:32:51 +0000","<a href=""http://twitter.com/download/iphone"" rel=""nofollow"">Twitter for iPhone</a>","?@Scobleizer: Social media community and addiction w/ @cshirky #Cinch: http://bit.ly/fuwfmH? /hope this gets me to crack cog surplus :)"
"30351443886080000","","","","","2011-01-26 19:48:42 +0000","<a href=""http://www.google.com/"" rel=""nofollow"">Google</a>","I liked a YouTube video -- Flying with Gestures http://youtu.be/LkHakM-vpM8?a"
"30350819987562496","","","","","2011-01-26 19:46:14 +0000","<a href=""http://twitter.com/download/iphone"" rel=""nofollow"">Twitter for iPhone</a>","?@christinacaci: More on mobile phones, contact lists, and sustainable networks: http://bit.ly/hpNMSb? via @gcsf"
"30350042795614208","","","30332978970238978","818340","2011-01-26 19:43:08 +0000","<a href=""http://twitter.com/download/iphone"" rel=""nofollow"">Twitter for iPhone</a>","RT @marshallk: the world is cruel & unfair, filled with emptiness  RT@dannysullivan: Demand Media, now worth more than NY Times. Wow. ht ..."
